{
  "event_id": "77777777-7777-4777-8777-777777777772",
  "event_type": "VARIANT_CREATED",
  "version": 1,
  "occurred_at": "2026-10-04T03:10:00Z",
  "aggregate_id": "33333333-3333-4333-8333-333333333333",
  "aggregate_version": 0,
  "aggregate_sequence": 1,
  "correlation_id": "synthetic-contract-example",
  "payload": {
    "product_id": "33333333-3333-4333-8333-333333333333",
    "variant_id": "66666666-6666-4666-8666-666666666666",
    "sku": "SYNTH-TEE-M-BLK",
    "version": 0
  }
}
