{
  "event_id": "77777777-7777-4777-8777-777777777771",
  "event_type": "USER_CREATED",
  "version": 1,
  "occurred_at": "2026-10-04T03:10:00Z",
  "aggregate_id": "88888888-8888-4888-8888-888888888888",
  "aggregate_version": 0,
  "aggregate_sequence": 1,
  "correlation_id": "synthetic-contract-example",
  "payload": {
    "user_id": "88888888-8888-4888-8888-888888888888",
    "locale": "vi"
  }
}
