{
  "event_id": "44444444-4444-4444-8444-444444444445",
  "event_type": "ORDER_COMPLETED",
  "version": 1,
  "occurred_at": "2026-10-17T03:05:00Z",
  "aggregate_id": "55555555-5555-4555-8555-555555555555",
  "aggregate_version": 5,
  "aggregate_sequence": 6,
  "correlation_id": "synthetic-contract-example",
  "payload": {
    "order_id": "55555555-5555-4555-8555-555555555555",
    "order_no": "FS-SYNTH-0001",
    "user_id": null,
    "order_version": 5,
    "items": [
      {
        "variant_id": "66666666-6666-4666-8666-666666666666",
        "sku": "SYNTH-TEE-M-BLK",
        "quantity": 2
      },
      {
        "variant_id": "66666666-6666-4666-8666-666666666667",
        "sku": "SYNTH-TEE-L-BLK",
        "quantity": 1
      }
    ],
    "delivered_at": "2026-10-17T02:59:00Z"
  }
}
