{
  "event_id": "77777777-7777-4777-8777-777777777781",
  "event_type": "NOTIFY_RESET_PASSWORD",
  "version": 1,
  "occurred_at": "2026-10-05T03:10:00Z",
  "aggregate_id": "88888888-8888-4888-8888-888888888888",
  "aggregate_version": 3,
  "aggregate_sequence": 2,
  "correlation_id": "synthetic-contract-example",
  "payload": {
    "dedupe_key": "RESET_PASSWORD:99999999-9999-4999-8999-999999999999",
    "user_id": "88888888-8888-4888-8888-888888888888",
    "recipient": {"email": "member@example.test"},
    "channel": "EMAIL",
    "locale": "vi",
    "template_key": "RESET_PASSWORD",
    "challenge_id": "99999999-9999-4999-8999-999999999999",
    "expires_at": "2026-10-05T03:40:00Z"
  }
}
