{
  "event_id": "11111111-1111-4111-8111-111111111111",
  "event_type": "CATALOG_CHANGED",
  "version": 1,
  "occurred_at": "2026-10-04T03:00:00Z",
  "aggregate_id": "33333333-3333-4333-8333-333333333333",
  "aggregate_version": 4,
  "aggregate_sequence": 7,
  "correlation_id": "synthetic-contract-example",
  "payload": {
    "product_id": "33333333-3333-4333-8333-333333333333",
    "affected_variant_ids": [],
    "version": 4
  }
}
